{
  "id": "6c1d2e3f-4a5b-4c6d-8e7f-90a1b2c3d4e5",
  "run_id": "3f2b8c1e-5d4a-4e6f-9a7b-1c2d3e4f5a6b",
  "tool_call_id": "call_2",
  "plugin_id": "team.telegram",
  "tool": "team.telegram.send_message",
  "risk": "write_external",
  "summary": "Отправить Яне Петровой в Telegram: «Надо купить молоко»",
  "arguments": {
    "to": "person:7c9e6679-7425-40de-944b-e07fc1f90ae7",
    "text": "Надо купить молоко"
  },
  "args_hash": "sha256:d2940d487c172b94a75ca891430a030569ec7450f9188b69081cf1ef29629b4d",
  "status": "approved",
  "created_at": "2026-10-09T10:00:05Z",
  "expires_at": "2026-10-09T10:02:05Z",
  "decision": {
    "decision": "approve",
    "decided_at": "2026-10-09T10:00:20Z",
    "channel": "android",
    "device_id": "a1b2c3d4-e5f6-4789-8abc-def012345678"
  }
}
